{
  "schemaVersion": 1,
  "protocolVersion": 1,
  "gameId": "pinyin-racer",
  "title": "拼音赛车",
  "entry": "games/learning-arcade/index.html",
  "runtime": {
    "hostId": "learning-arcade",
    "mode": "word-cannon"
  },
  "domains": ["pinyin"],
  "capabilities": ["standalone", "host", "legacy-result"],
  "cardSchema": {
    "required": ["cardId"],
    "optional": ["word", "translation", "image", "audio", "example", "domain", "contentType"],
    "unknownFields": "ignore",
    "missingOptional": "null",
    "preserveCardId": true
  },
  "legacy": {
    "source": "petbank-learning-arcade",
    "messageKind": "result",
    "cardIdSource": "待宿主输入 cardId；当前 word-cannon 结果只包含 gameId 和汇总 stats",
    "resultFields": ["gameId", "gameLabel", "title", "copy", "stats", "settings", "activeGame"]
  }
}
